"question","module","answer","type"
Is the salary structure type the direct parent of salary rules in Odoo's salary hierarchy?,Human Resource,0,multihop
Does a payslip's Salary Computation tab get populated automatically when the payslip form is first created?,Human Resource,0,multihop
Can a manager identify which employees logged the most overtime using the Attendance Reporting feature in Odoo?,Human Resource,1,multihop
"Does the Onboarding plan in Odoo Employees require the Fleet app to be installed for the ""Take Back Fleet"" offboarding step to appear?",Human Resource,1,multihop
Is the YTD Reset Date a field that must be configured after a payroll localization has been installed?,Human Resource,1,multihop
Does enabling Batch Account Move Lines in Payroll Accounting settings prevent the creation of individual payments?,Human Resource,1,multihop
Can an applicant's resume be stored in the Odoo Documents application when Résumé Digitization is enabled?,Human Resource,1,multihop
Is the attendance widget in Odoo Attendances directly accessible from the main menu without clicking a colored circle icon?,Human Resource,0,multihop
Does a new job position in Odoo Recruitment require the expected skills to be defined by the Employees app rather than within Recruitment itself?,Human Resource,1,multihop
Does the Odoo Payroll module use data from the Attendances app when calculating employee work entries?,Human Resource,1,multihop
Is it possible for an accrual plan in Time Off to carry over unused time to the next year with a maximum cap?,Human Resource,1,multihop
"Does a refund payslip in Odoo have a default status of ""Done"" when first created?",Human Resource,0,multihop
Can the Public Holidays configured in the Time Off app affect apps like Planning and Manufacturing that use working schedules?,Human Resource,1,multihop
"Is the ""Difference"" field in the Attendance report the same as the Balance field?",Human Resource,0,multihop
Does enabling the Salary Configurator module allow employees to request extra time off during salary package negotiations?,Human Resource,1,multihop
Is the Contract Signed stage in the Recruitment flow the last stage before a new employee record is created?,Human Resource,1,multihop
Does deleting a recruitment stage in Odoo require all applicants currently in that stage to be moved or archived first?,Human Resource,1,multihop
Can the Payroll module generate payslips without any reference to an employee's working schedule?,Human Resource,0,multihop
Does the check-in action in Odoo Attendances log the employee's GPS coordinates and IP address?,Human Resource,1,multihop
"Is the ""Recruitment: Schedule Interview"" email template automatically sent when an applicant's card moves to the First Interview stage (if configured)?",Human Resource,1,multihop
Does the Non-Working Days Rule in Attendance overtime rulesets use a Quantity-based calculation?,Human Resource,0,multihop
Is it possible for a single company in Odoo Payroll to have multiple salary localization settings active simultaneously?,Human Resource,0,multihop
Does launching an onboarding plan in Odoo require the employee to already have a user account in the database?,Human Resource,1,multihop
"Is the ""Total today"" field in the Attendance check-out widget the sum of the ""Before HH:MM"" and ""Since HH:MM"" fields?",Human Resource,1,multihop
Does an overtime ruleset in Odoo Attendances come preconfigured by default when the Attendances app is installed?,Human Resource,0,multihop
"Can a salary adjustment of type ""Child Support"" be configured through Payroll → Configuration → Other Input Types?",Human Resource,1,multihop
Is the Expected Hours field in the Attendance report derived from the employee's working schedule set on their employee form?,Human Resource,1,multihop
"Does moving an applicant to the ""Contract Proposal"" stage in Recruitment automatically send them a signed contract?",Human Resource,0,multihop
Is a payslip batch required to process individual payslips in Odoo Payroll?,Human Resource,0,multihop
"Does the Offboarding plan's ""Organize knowledge transfer inside the team"" step get assigned to the fleet manager by default?",Human Resource,0,multihop
Can an employee's Family section information (e.g. marital status and number of dependent children) affect how their payroll is calculated in Odoo?,Human Resource,1,multihop
"Does creating a new Skill Type in the Employees app with the ""Certification"" toggle enabled allow that skill to appear in the employee's Certifications tab?",Human Resource,1,multihop
